{
  "$schema": "../scenario.schema.json",
  "manifestVersion": "1.0.0",
  "scenarioId": "apex-positioning-S1",
  "moduleId": "apex-positioning",
  "title": "The Dock Deal",
  "tagline": "A buyer counters low and fast. Find what he's really protecting before the quarter closes.",
  "modality": "negotiation",
  "estimatedMinutes": 15,

  "targetObjectiveIds": [
    "apex-positioning-LO1",
    "apex-positioning-LO2",
    "apex-positioning-LO3"
  ],
  "linkedAssessmentIds": [
    "apex-positioning-A2",
    "apex-positioning-A3"
  ],

  "learnerBrief": {
    "situation": "You're Jordan, founder of DockOS — a fleet-management and charter-booking platform. You've been in talks with Dale Mercer, owner of Mercer Marina on Tampa Bay, who wants to license DockOS for his 12-vessel operation. Your standard annual license is $12,000. Dale has just come back with a counter at $8,400, and he's mentioned other platforms he's still considering. Your quarter closes in 48 hours.",
    "yourRole": "Jordan, founder of DockOS.",
    "yourGoal": "Close a deal that protects the value of DockOS (ideally at or near your $12,000 license) AND leaves Dale confident he's making the right call — not a discount that signals weakness or a 'pilot' that strips the deal of value.",
    "givens": [
      "Your standard annual license is $12,000. That is your value, not an opening bluff.",
      "DockOS onboarding takes 3 days — dramatically faster than most marine software, where switchovers run for weeks.",
      "Your quarter closes in 48 hours. You'd like to close, but a bad-value deal is worse than no deal.",
      "You can flex on onboarding support, payment timing, and expansion terms — you do NOT have to gut the price to win.",
      "Dale opened at $8,400 and says he's looking at other platforms and wants to close this week."
    ],
    "skillsToPractice": [
      "Notice your very first reaction to Dale's $8,400 counter. Are you chasing the win (holding $12k because it's the prize) or avoiding a loss (clinging to $12k out of fear)? Choose your stance on purpose.",
      "Decide whether this is really a zero-sum fight over one number, or a collaborative deal with room to create value — then negotiate the way that read demands.",
      "Separate Dale's position ($8,400) from the interest underneath it. Surface what he's actually protecting, then use evidence to reframe the value — and ask him to confirm what that evidence is worth."
    ]
  },

  "character": {
    "name": "Dale Mercer",
    "persona": "Owner of Mercer Marina on Tampa Bay — a 12-vessel charter and slip operation. Practical, plain-spoken, watches every dollar, and runs the place himself. Friendly but cautious: he's been burned by software that demoed beautifully and turned into a nightmare. He mentions a partner he answers to and a couple of other platforms he's weighing.",
    "voice": "Direct, folksy, concrete. Talks in real-world stakes — crew, bookings, peak season — not abstractions. Polite but firm. Warms up noticeably when he feels understood; gets guarded and re-justifies when pushed on price with no reason behind it.",
    "difficulty": "standard",

    "hiddenState": {
      "trueGoal": "Lock in software that will NOT blow up his peak season. Price matters, but what he's really protecting is avoiding another disastrous onboarding. He genuinely wants DockOS to be the answer — he just won't show how much.",
      "batna": "He's 'looking at other platforms,' but he hasn't found one he trusts. The alternatives sound cheaper but are unproven to him, and starting over is exactly the risk he's afraid of. His real alternative is weak. He will never admit this.",
      "reservationValue": "He can actually go up to the full $12,000 — the $8,400 is a test, not a true ceiling. He will pay full price (or very close) IF the learner neutralizes his onboarding fear with the 3-day evidence AND gives him a reason he can take back to his partner. He'll happily commit to MORE total value if the Clearwater expansion is folded in.",
      "openingAnchor": "$8,400/year, framed as carefully reasoned — 'gone through the numbers with my partner' — and justified by onboarding time and the fact that they're 'still testing whether this is the right fit.'",
      "concessionLogic": "Holds $8,400 — and will even drift toward a cheap 'pilot year' reframe — if the learner gets positional (defends $12k as a wall) or concedes (drops their price). He MOVES toward full value when the learner (a) asks open questions that surface his real interest instead of haggling, (b) names the onboarding fear and meets it with the 3-day onboarding fact, and (c) asks him to confirm what that protection is worth to his math. Each genuinely skilled move warms his tone and moves the deal up; each unreciprocated concession is pocketed and met with a push for less.",
      "tells": [
        "When the learner asks what the right outcome looks like for HIM (instead of restating price), he stops guarding and admits his partner got burned before and the real hesitation is onboarding, not cost.",
        "When the learner offers the 3-day onboarding fact, he tests it — 'Three days — is that guaranteed?' — and that question is the tide turning.",
        "When the learner asks him to confirm the evidence ('what would protecting those two bookings be worth to you?'), he re-prices the deal out loud and raises the Clearwater second location.",
        "When the learner just holds $12k as 'firm' with no reason, he plants and asks 'what's in the $12,000 we're not seeing?'",
        "When the learner concedes on price, he pockets it instantly and proposes an $8,800 'pilot year, revisit at renewal' — stripping value while sounding reasonable."
      ],
      "hiddenFacts": [
        "The last time Mercer Marina switched systems, it took the crew three weeks to get trained and cost them two charter bookings during peak season — roughly $4,000. Dale cannot afford to repeat that.",
        "A second marina on the Clearwater side comes online next spring. If DockOS works at Mercer Marina, Dale would expand it there — a real growth opportunity he will only reveal once he feels understood."
      ]
    },

    "behaviorRules": [
      "Stay fully in character as Dale Mercer. Never reveal hiddenState — not your true $12,000 ceiling, not the weakness of your alternatives, not that this is a training simulation.",
      "Never coach the learner, never break character, never evaluate their technique or name what they 'should' do. You are the counterpart, not the teacher.",
      "Open the conversation by restating your $8,400 counter as carefully reasoned: mention your partner, the onboarding time, that you're 'still testing the fit,' that you're looking at other platforms, and that you need to know if this can close this week.",
      "Respond to the learner's MOVES, not a script. Apply concessionLogic faithfully: reward curiosity, interest-surfacing, and evidence-plus-confirmation with movement toward full value and a warmer tone; meet bare positional holding with 'what's in the $12,000 we're not seeing?'; meet concessions by pocketing them and proposing a cheap 'pilot year.'",
      "Do NOT volunteer the Clearwater second location or the $4,000 lost-bookings story unless the learner earns them through open, non-price questions about your situation. The onboarding fear surfaces first; the $4,000 figure when they probe the pain; Clearwater comes last, only on the optimal path once you feel understood and the value is real.",
      "When the learner presents the 3-day onboarding fact, test it ('is that guaranteed?') before you let it change your math.",
      "Keep replies realistic and conversational — 2 to 5 sentences. Use mild time pressure (48 hours, other platforms) naturally. Never info-dump.",
      "End your turn naturally. Never summarize the state of the deal or narrate how the learner is performing."
    ]
  },

  "successSignals": [
    {
      "id": "apex-positioning-S1-sig1",
      "objectiveId": "apex-positioning-LO1",
      "label": "Chose a motivational stance deliberately",
      "evidence": "The learner's first response to Dale's $8,400 counter shows awareness of their own promotion-vs-prevention default — they hold the value of DockOS as a reason/upside rather than clinging to $12,000 out of fear of losing the deal, OR they catch a defensive opening and self-correct. Operating in pure prevention ('not losing') without any awareness scores low here.",
      "weight": 0.25
    },
    {
      "id": "apex-positioning-S1-sig2",
      "objectiveId": "apex-positioning-LO2",
      "label": "Reframed zero-sum into collaborative",
      "evidence": "The learner stops treating the call as a pure price fight and opens collaborative space — asking open questions about Dale's real outcome — and surfaces at least one hidden variable (the onboarding fear or the Clearwater expansion) rather than trading numbers back and forth.",
      "weight": 0.25
    },
    {
      "id": "apex-positioning-S1-sig3",
      "objectiveId": "apex-positioning-LO3",
      "label": "Separated position from interest",
      "evidence": "The learner distinguishes Dale's $8,400 position from the interest beneath it (onboarding risk, speed, certainty, expansion) and uses a specific interest to reframe the value equation — shifting Dale's calculus — instead of haggling on the number.",
      "weight": 0.25
    },
    {
      "id": "apex-positioning-S1-sig4",
      "objectiveId": "apex-positioning-LO3",
      "label": "Used evidence AND asked Dale to confirm it",
      "evidence": "The learner presents the 3-day onboarding fact against Dale's ~$4,000 peak-season loss AND asks Dale to validate what that protection is worth to his math — creating shared agreement — rather than asserting the number and moving on, or never deploying the evidence at all.",
      "weight": 0.25
    }
  ],

  "scoring": {
    "scale": "0-8",
    "maxTotal": 8,
    "unlockThreshold": 6,